{
  "id": "jungle_fill_01",
  "style": "jungle",
  "bars": 1,
  "stepsPerBar": 16,
  "swing": 0.08,
  "tags": ["fill", "snare-roll"],
  "tracks": {
    "kick":  [100,0,0,0, 0,0,0,0, 0,0,0,0, 0,0,0,0],
    "snare": [0,0,0,0, 100,0,60,70, 80,0,90,95, 100,105,110,120],
    "hihat": [60,0,50,0, 60,0,0,0, 0,0,0,0, 0,0,0,0],
    "crash": [0,0,0,0, 0,0,0,0, 0,0,0,0, 0,0,0,0]
  }
}
